[
  {
    "finding_id": "iam_administrator_access_with_mfa",
    "resource_uid": "arn:aws:iam::010603499647:group/cloud-security-admins1",
    "severity": "high",
    "service": "iam",
    "category": "identity-access",
    "risk": "**Admin users without MFA** are vulnerable to single-factor compromise. Stolen or guessed credentials can yield full control, enabling privilege escalation, policy changes, data exfiltration, and destructive operations, impacting **confidentiality**, **integrity**, and **availability**.",
    "status": "FAIL",
    "owner": "IAM",
    "disposition": "MANUAL_REMEDIATE",
    "lifecycle_status": "OPEN",
    "check_title": "IAM group members granted AdministratorAccess have MFA enabled",
    "resource_type": "AwsIamGroup",
    "resource_name": "cloud-security-admins1",
    "status_extended": "Group cloud-security-admins1 provides administrator access to User cloud-security-admin with MFA disabled.",
    "remediation": "Enforce **MFA** for all administrator identities.\n- Add conditions (e.g., `aws:MultiFactorAuthPresent`) to privileged permissions\n- Prefer **hardware/FIDO2** devices\n- Apply **least privilege** and favor **roles/SSO** over users\n- Continuously monitor MFA status and remove unused admin access",
    "compliance": "ASD-Essential-Eight-Nov 2023: E8-3.1 | SecNumCloud-3.2: 9.6 | AWS-Foundational-Technical-Review: IAM-001, IAM-0012 | CCC-v2025.10: CCC.Core.CN03.AR01, CCC.Core.CN03.AR02, CCC.Core.CN03.AR03, CCC.Core.CN05.AR02, CCC.Core.CN05.AR04, CCC.Core.CN05.AR06 | KISA-ISMS-P-2023: 2.5.3, 2.5.5, 2.10.2 | ENS-RD2022: op.acc.6.r2.aws.iam.1 | FedRAMP-20x-KSI-Low-25.05C: ksi-iam | NIST-CSF-2.0: rr_1, ac_4, ip_1 | MITRE-ATTACK: T1078, T1098, T1550 | NIS2: 11.1.2.c, 11.3.2.a, 11.7.2 | C5-2025: SP-01.04B, HR-01.01B, OPS-16.01B, IAM-04.06B, IAM-06.09B, IAM-08.05B, IAM-09.02B, IAM-09.01AC, IAM-10.01B, PSS-05.01B, PSS-05.02B, PSS-07.02B | KISA-ISMS-P-2023-korean: 2.5.3, 2.5.5, 2.10.2 | AWS-AI-Security-Framework-1.0: AISF-IAM-01",
    "categories": "identity-access"
  },
  {
    "finding_id": "iam_avoid_root_usage",
    "resource_uid": "arn:aws:iam::010603499647:root",
    "severity": "high",
    "service": "iam",
    "category": "identity-access",
    "risk": "Recent **root usage** expands blast radius:\n- Data exfiltration (**confidentiality**)\n- Policy/key tampering (**integrity**)\n- Resource deletion and billing changes (**availability**)\nRoutine use reduces anomaly visibility and eases **account takeover** impact.",
    "status": "FAIL",
    "owner": "ACCOUNT_SECURITY",
    "disposition": "MANUAL_REMEDIATE",
    "lifecycle_status": "OPEN",
    "check_title": "AWS account root user has not been used in the last day",
    "resource_type": "AwsIamUser",
    "resource_name": "<root_account>",
    "status_extended": "Root user in the account was last accessed 0 days ago.",
    "remediation": "Minimize `root` usage by applying **least privilege** with admin roles or federated SSO and temporary credentials.\n- Enforce **MFA** on root\n- Avoid or remove root access keys\n- Require multi-person approval\n- **Monitor and alert** on any root sign-in\n- Use org guardrails for **defense in depth**",
    "compliance": "CIS-4.0.1: 1.7 | SecNumCloud-3.2: 9.6 | CIS-6.0: 2.6 | CIS-3.0: 1.7 | AWS-Well-Architected-Framework-Security-Pillar: SEC02-BP01 | ISO27001-2022: A.5.15 | CCC-v2025.10: CCC.Core.CN05.AR02 | CIS-1.5: 1.7 | CIS-7.0: 2.7 | KISA-ISMS-P-2023: 2.5.1, 2.5.5, 2.10.2 | ENS-RD2022: op.acc.2.aws.iam.4, op.acc.4.aws.iam.7 | ISO27001-2013: A.9.2.H, A.9.4.H | CIS-5.0: 1.6 | MITRE-ATTACK: T1078, T1098 | CIS-1.4: 1.7 | NIS2: 6.7.2.e, 11.3.2.b, 11.3.2.c, 11.4.2.a | C5-2025: IAM-03.01B, IAM-03.03B, IAM-06.02B, IAM-06.04B | CIS-2.0: 1.7 | AWS-Account-Security-Onboarding: Block root user | ProwlerThreatScore-1.0: 1.2.5 | KISA-ISMS-P-2023-korean: 2.5.1, 2.5.5, 2.10.2 | AWS-AI-Security-Framework-1.0: AISF-IAM-04",
    "categories": "identity-access"
  },
  {
    "finding_id": "iam_aws_attached_policy_no_administrative_privileges",
    "resource_uid": "arn:aws:iam::aws:policy/AdministratorAccess",
    "severity": "critical",
    "service": "iam",
    "category": "identity-access",
    "risk": "**Unrestricted `*:*` access** enables any action on any resource, risking:\n- Data exfiltration (**confidentiality**)\n- Unauthorized changes and policy tampering (**integrity**)\n- Service deletion or shutdown (**availability**)\nAttackers can disable logging, create backdoor principals, and expand lateral movement.",
    "status": "FAIL",
    "owner": "IAM",
    "disposition": "MANUAL_REMEDIATE",
    "lifecycle_status": "OPEN",
    "check_title": "Attached AWS-managed IAM policy does not allow '*:*' administrative privileges",
    "resource_type": "AwsIamPolicy",
    "resource_name": "AdministratorAccess",
    "status_extended": "AWS policy AdministratorAccess is attached and allows '*:*' administrative privileges.",
    "remediation": "Apply **least privilege**: avoid attaching AWS-managed policies that grant `*:*`.\n- Use **customer-managed, scoped policies** per role\n- Enforce **separation of duties** and **permissions boundaries**\n- Prefer **temporary, time-bound elevation** for emergencies with MFA\n- Regularly review access and use conditions to constrain context",
    "compliance": "ASD-Essential-Eight-Nov 2023: E8-4.4 | CIS-4.0.1: 1.16 | FedRAMP-Low-Revision-4: ac-2, ac-3 | SecNumCloud-3.2: 9.1 | FedRamp-Moderate-Revision-4: ac-2-1, ac-2-f, ac-2-j, ac-3, ac-5-c, ac-6-10, ac-6, sc-2 | SOC2: cc_1_3, cc_6_3 | NIST-800-53-Revision-5: ac_2_1, ac_2_6, ac_2_i_2, ac_3, ac_3_3, ac_3_3_a, ac_3_3_b_1, ac_3_3_b_2, ac_3_3_b_3, ac_3_3_b_4, ac_3_3_b_5, ac_3_3_c, ac_3_4, ac_3_4_a, ac_3_4_b, ac_3_4_c, ac_3_4_d, ac_3_4_e, ac_3_7, ac_3_8, ac_3_12_a, ac_3_13, ac_3_15_a, ac_3_15_b, ac_4_28, ac_5_b, ac_6, ac_6_2, ac_6_3, ac_6_10, ac_24, cm_5_1_a, cm_6_a, cm_9_b, mp_2, sc_23_3, sc_25 | FFIEC: d3-pc-am-b-1, d3-pc-am-b-16, d3-pc-am-b-2, d3-pc-am-b-3, d3-pc-am-b-6, d3-pc-im-b-7 | CIS-6.0: 2.15 | CIS-3.0: 1.16 | NIST-800-171-Revision-2: 3_1_1, 3_1_2, 3_1_4, 3_1_5, 3_1_6, 3_1_7, 3_4_6, 3_13_3 | AWS-Well-Architected-Framework-Security-Pillar: SEC03-BP02 | ISO27001-2022: A.5.18, A.8.2 | NIST-CSF-1.1: ac_1, ac_4, pt_3 | RBI-Cyber-Security-Framework: annex_i_7_1 | CCC-v2025.10: CCC.Core.CN05.AR02, CCC.IAM.CN01.AR01, CCC.IAM.CN01.AR02, CCC.IAM.CN02.AR01, CCC.IAM.CN02.AR02, CCC.IAM.CN04.AR01 | CIS-1.5: 1.16 | CIS-7.0: 2.14 | KISA-ISMS-P-2023: 2.5.1, 2.5.5, 2.5.6, 2.10.2 | ENS-RD2022: op.acc.4.aws.iam.1, op.acc.4.aws.iam.2, op.acc.4.aws.iam.9, op.exp.8.r4.aws.ct.8 | GxP-21-CFR-Part-11: 11.10-d, 11.10-g | CIS-5.0: 1.15 | FedRAMP-20x-KSI-Low-25.05C: ksi-iam | NIST-CSF-2.0: rr_1, rr_2, po_1, ac_1 | NIST-800-53-Revision-4: ac_2, ac_3, ac_5, ac_6, sc_2 | MITRE-ATTACK: T1078, T1648, T1098, T1578, T1550, T1040, T1580, T1538, T1619, T1201 | CIS-1.4: 1.16 | CISA: your-systems-3, your-surroundings-3 | C5-2025: OIS-04.03B, OIS-04.01AC, SP-01.04B, HR-01.01B, IAM-01.01B, IAM-01.04B | CIS-2.0: 1.16 | GDPR: article_25 | AWS-Foundational-Security-Best-Practices: IAM.1 | ProwlerThreatScore-1.0: 1.3.1 | HIPAA: 164_308_a_1_ii_b, 164_308_a_3_i, 164_308_a_3_ii_b, 164_308_a_4_i, 164_308_a_4_ii_b, 164_308_a_4_ii_c, 164_312_a_1 | KISA-ISMS-P-2023-korean: 2.5.1, 2.5.5, 2.5.6, 2.10.2 | AWS-AI-Security-Framework-1.0: AISF-IAM-02",
    "categories": "identity-access"
  },
  {
    "finding_id": "iam_check_saml_providers_sts",
    "resource_uid": "arn:aws:iam::010603499647:root",
    "severity": "low",
    "service": "iam",
    "category": "identity-access",
    "risk": "Without **SAML federation**, users rely on **long-lived IAM keys**. Compromised keys enable persistent API access, causing **data exfiltration (C)**, unauthorized resource or policy changes (**I**), and difficult revocation. Lack of IdP controls (e.g., **MFA**, session limits) weakens **accountability** and access governance.",
    "status": "FAIL",
    "owner": "IDENTITY",
    "disposition": "REPORT_ONLY",
    "lifecycle_status": "OPEN",
    "check_title": "IAM SAML provider exists in the account",
    "resource_type": "Other",
    "resource_name": "010603499647",
    "status_extended": "No SAML Providers found.",
    "remediation": "Adopt **SAML federation** to issue **short-lived STS credentials**. Map users to roles with **least privilege**, enforce **MFA** at the IdP, and set conservative session durations. Retire IAM user access keys for interactive use and monitor role sessions as **defense in depth**. *If federation isn't possible*, tightly scope, rotate, and audit keys.",
    "compliance": "CIS-4.0.1: 1.21 | CIS-6.0: 2.20 | CIS-3.0: 1.21 | CCC-v2025.10: CCC.Core.CN05.AR06, CCC.IAM.CN09.AR01 | CIS-1.5: 1.21 | CIS-7.0: 2.19 | KISA-ISMS-P-2023: 2.5.3, 2.10.2 | ENS-RD2022: op.acc.1.aws.iam.2 | CIS-5.0: 1.20 | NIST-CSF-2.0: ac_7 | CIS-1.4: 1.21 | CIS-2.0: 1.21 | ProwlerThreatScore-1.0: 1.2.7 | KISA-ISMS-P-2023-korean: 2.5.3, 2.10.2",
    "categories": "identity-access"
  },
  {
    "finding_id": "iam_group_administrator_access_policy",
    "resource_uid": "arn:aws:iam::010603499647:group/cloud-security-admins1",
    "severity": "high",
    "service": "iam",
    "category": "identity-access",
    "risk": "Group-wide `AdministratorAccess` gives all members unrestricted control. A stolen or misused account can:\n- Read/exfiltrate sensitive data (C)\n- Modify or delete resources and configs (I/A)\n- Disable logging and weaken defenses, enabling persistence and lateral movement",
    "status": "FAIL",
    "owner": "IAM",
    "disposition": "MANUAL_REMEDIATE",
    "lifecycle_status": "OPEN",
    "check_title": "IAM group does not have AdministratorAccess policy attached",
    "resource_type": "AwsIamGroup",
    "resource_name": "cloud-security-admins1",
    "status_extended": "IAM Group cloud-security-admins1 has AdministratorAccess policy attached.",